{
  "slug": "enfp-pop",
  "name": "ENFP Pop",
  "summary": "高饱和青橙与自由脑暴氛围，面向快速原型、灵感探索和轻快创作。",
  "author": { "name": "Codex Skin", "handle": "codex-skin", "curated": true },
  "category": "editorial",
  "platforms": ["macos", "windows"],
  "colors": ["teal", "orange"],
  "tags": ["真实主题", "ENFP", "脑暴", "高饱和", "双平台"],
  "stats": { "downloads": 0, "rating": 0, "reviews": 0 },
  "featured": false,
  "isNew": true,
  "version": "1.0.0",
  "engineRange": ">=1.0.0 <2.0.0",
  "publishedAt": "2026-07-17T06:00:00.000Z",
  "license": { "name": "Codex-Skin Theme Assets", "spdx": "LicenseRef-Codex-Skin-Theme", "source": "project-curated-assets" },
  "package": { "published": true, "id": "enfp-pop", "version": "1.0.0", "url": "https://github.com/lixiaobaivv/Codex-Skin/releases/download/official-themes-v1/Codex-Skin-theme-enfp-pop-1.0.0.dreamskin", "sha256": "b9f9b08b2707a83c4b404c4dc98d82334baa0b01e5c3c44fda3554d7438da336", "size": 956764 },
  "previewImage": "/theme-previews/enfp-pop.png",
  "previewStyle": { "backgroundColor": "#fffaf0", "backgroundImage": "linear-gradient(#fffaf0, #fff0dc)", "panelColor": "#fffaf0", "panelBorder": "#efcfae", "textColor": "#202335", "mutedTextColor": "#77726d", "accentColor": "#12bfa5", "accentSoft": "#d7f5ef", "codeColor": "#ffb31a", "shadow": "0 28px 80px rgba(255,106,87,.2)", "pattern": "paper" }
}
