{
  "slug": "zhu-xudan-racing",
  "name": "Zhu Xudan Racing",
  "summary": "赛车红黑与卡丁车疾速氛围，包含人物背景、竞速 Logo、首页引导与四张快捷操作卡。",
  "author": { "name": "Codex Skin", "handle": "codex-skin", "curated": true },
  "category": "dark",
  "platforms": ["macos", "windows"],
  "colors": ["rose", "orange", "black"],
  "tags": ["祝绪丹", "人物", "赛车", "卡丁车", "深色", "双平台"],
  "stats": { "downloads": 0, "rating": 0, "reviews": 0 },
  "featured": false,
  "isNew": true,
  "version": "1.0.0",
  "engineRange": ">=1.0.0 <2.0.0",
  "publishedAt": "2026-07-17T08:11:01.000Z",
  "license": { "name": "Codex-Skin Theme Assets", "spdx": "LicenseRef-Codex-Skin-Theme", "source": "project-curated-assets" },
  "package": null,
  "previewImage": "/theme-previews/zhu-xudan-racing.png",
  "previewStyle": { "backgroundColor": "#17191e", "backgroundImage": "linear-gradient(135deg, #0d0f12, #2a1718)", "panelColor": "#17191e", "panelBorder": "#4a2a2b", "textColor": "#f7f4ef", "mutedTextColor": "#b9b3ad", "accentColor": "#e53935", "accentSoft": "#4a1f20", "codeColor": "#ffb020", "shadow": "0 28px 80px rgba(0,0,0,.42)", "pattern": "embers" }
}
